{
  "$schema": "https://json-schema.org/draft/2020-12/schema",
  "$id": "https://caseware.invalid/docs/en/data/dynamo/schemas/ms-engagement-index/template_graph_replica.TemplateGraphNode.schema.json",
  "title": "template_graph_replica item: TemplateGraphNode",
  "description": "One version node of the local DAG replica. DISENO S3 (c) attributes parents, branch, status, seq; 'status' is unified as 'state' and the version label is 'templateVersion' (the attribute 'version' is reserved for optimistic concurrency).",
  "$comment": "Table template_graph_replica (per cell): local replica of the version DAG fed by EV-03/EV-04 (ADR-018, DEC-04). Item types: TemplateGraphNode (PK = TPL#<templateId>, SK = V#<templateVersion>) and TemplateGraphMeta (PK = TPL#<templateId>, SK = META). AP-I6: TransactWriteItems(node + META.appliedSeq) with condition appliedSeq = seq - 1. No TTL (graph is permanent; WITHDRAWN is never deleted, DISENO 4.6). No GSI.",
  "type": "object",
  "properties": {
    "PK": {
      "type": "string",
      "description": "Partition key. PK = \"TPL#<templateId>\".",
      "pattern": "^TPL#[0-9a-f]{8}-[0-9a-f]{4}-[0-9a-f]{4}-[0-9a-f]{4}-[0-9a-f]{12}$"
    },
    "SK": {
      "type": "string",
      "description": "Sort key. SK = \"V#<templateVersion>\".",
      "pattern": "^V#.+$"
    },
    "entityType": {
      "type": "string",
      "const": "TemplateGraphNode",
      "description": "Discriminator of the item type (technical)."
    },
    "templateId": {
      "type": "string",
      "format": "uuid",
      "description": "Template id."
    },
    "templateVersion": {
      "type": "string",
      "description": "Version label of the node (EV-03 'version')."
    },
    "parents": {
      "type": "array",
      "items": {
        "type": "string"
      },
      "description": "Parent version labels (>= 0; >= 2 on a merge, PRD 2.1)."
    },
    "branch": {
      "type": "string",
      "description": "Market branch."
    },
    "seq": {
      "type": "integer",
      "description": "templateSeq assigned by ms-template-catalog (ADR-018)."
    },
    "version": {
      "type": "integer",
      "description": "Optimistic-concurrency attribute (CLAUDE.md DynamoDB rules; RF-067): every write is conditional on the previous value and increments it."
    },
    "createdBy": {
      "type": "string",
      "format": "uuid",
      "description": "Audit (technical, mandatory): principal id that created the item; system writers use the service-principal uuid configured per service."
    },
    "createdAt": {
      "type": "string",
      "format": "date-time",
      "description": "Audit (technical, mandatory): creation instant (ISO-8601 UTC)."
    },
    "updatedBy": {
      "type": "string",
      "format": "uuid",
      "description": "Audit (technical, mandatory): principal id of the last write; changes on every write."
    },
    "updatedAt": {
      "type": "string",
      "format": "date-time",
      "description": "Audit (technical, mandatory): instant of the last write; changes on every write."
    },
    "state": {
      "type": "string",
      "enum": [
        "PUBLISHED",
        "WITHDRAWN"
      ],
      "description": "Audit/lifecycle state. Source: PRD 2.2 / INV-02 (WITHDRAWN is irreversible)."
    }
  },
  "required": [
    "PK",
    "SK",
    "entityType",
    "templateId",
    "templateVersion",
    "parents",
    "branch",
    "seq",
    "version",
    "createdBy",
    "createdAt",
    "updatedBy",
    "updatedAt",
    "state"
  ],
  "additionalProperties": false
}
